{
  "language": "de",
  "title": "Essig-Salatsoße",
  "default_servings": 1,
  "serving_unit": "Portionen",
  "meal_type": "basic",
  "tags": ["vegetarian"],
  "version": 1,
  "ingredients": [
    { "name": "Milch (3 Teile)" },
    { "name": "heller Balsamico-Essig (1 Teil)" },
    { "name": "Öl (2 Teile)" },
    { "name": "Saft oder Smoothie (2 Teile)" },
    { "name": "Agavendicksaft" },
    { "name": "Salz" }
  ],
  "instructions": [
    "Alle Zutaten im angegebenen Verhältnis vermischen und gut schütteln.",
    "Mit Agavendicksaft und Salz abschmecken."
  ],
  "translations": {
    "en": {
      "title": "Vinegar Salad Dressing",
      "serving_unit": "servings",
      "ingredients": [
        "milk (3 parts)",
        "light balsamic vinegar (1 part)",
        "oil (2 parts)",
        "juice or smoothie (2 parts)",
        "agave syrup",
        "salt"
      ],
      "instructions": [
        "Mix all ingredients in the given ratio and shake well.",
        "Season with agave syrup and salt."
      ]
    }
  }
}
