{
  "language": "de",
  "title": "Schafskäse in Tomatensoße mit Grillgemüse",
  "default_servings": 1,
  "serving_unit": "Portionen",
  "meal_type": "main",
  "tags": [
    "vegetarian"
  ],
  "version": 1,
  "ingredients": [
    {
      "name": "Schafskäse",
      "amount": 1,
      "unit": "package"
    },
    {
      "name": "Tomatensoße",
      "amount": 200,
      "unit": "ml"
    },
    {
      "name": "Zucchini"
    },
    {
      "name": "Paprika"
    },
    {
      "name": "Karotten"
    },
    {
      "name": "Süßkartoffeln"
    }
  ],
  "instructions": [
    "Das Gemüse waschen, eventuell schälen und in Stücke schneiden.",
    "In einer Schüssel mit Öl und Gewürzen mischen und auf ein Backblech geben.",
    "Bei {{!200 °C}} 30 Minuten garen.",
    "Den Schafskäse in 4 Stücke schneiden. Die Tomatensoße in eine Auflaufform geben und den Schafskäse hineinlegen.",
    "Die Auflaufform nach 15 Minuten zum Grillgemüse in den Ofen schieben und zusammen noch 15 Minuten backen."
  ],
  "translations": {
    "en": {
      "title": "Feta in Tomato Sauce with Grilled Vegetables",
      "serving_unit": "servings",
      "ingredients": [
        "feta",
        "tomato sauce",
        "zucchini",
        "bell pepper",
        "carrots",
        "sweet potatoes"
      ],
      "instructions": [
        "Wash the vegetables, peel if necessary and cut into pieces.",
        "Mix in a bowl with oil and spices and spread on a baking tray.",
        "Roast at {{!200 °C}} for 30 minutes.",
        "Cut the feta into 4 pieces. Pour the tomato sauce into a baking dish and place the feta in it.",
        "After 15 minutes, slide the baking dish into the oven next to the grilled vegetables and bake together for another 15 minutes."
      ]
    }
  }
}