{
  "language": "de",
  "title": "Lasagne",
  "default_servings": 6,
  "serving_unit": "Portionen",
  "meal_type": "main",
  "tags": [
    "vegetarian"
  ],
  "related_recipes": [
    "bolognese_sauce",
    "bechamel_sauce"
  ],
  "version": 1,
  "ingredients": [
    {
      "name": "Lasagne-Platten",
      "amount": 800,
      "unit": "g"
    },
    {
      "name": "Bolognesesoße",
      "amount": 1000,
      "unit": "ml"
    },
    {
      "name": "Béchamelsoße",
      "amount": 650,
      "unit": "ml"
    },
    {
      "name": "Schmand",
      "amount": 200,
      "unit": "ml"
    },
    {
      "name": "Streukäse",
      "amount": 300,
      "unit": "g"
    }
  ],
  "instructions": [
    "Abwechselnd Bolognese- und Béchamelsoße mit Lasagne-Platten schichten.",
    "Im Kühlschrank ziehen lassen, am besten über Nacht.",
    "Im vorgeheizten Backofen bei {{160 °C}} Umluft ca. 45 Minuten backen.",
    "Herausnehmen, mit Schmand bestreichen und Käse darauf verteilen.",
    "Noch einmal 15 Minuten backen."
  ],
  "translations": {
    "en": {
      "title": "Lasagna",
      "serving_unit": "servings",
      "ingredients": [
        "lasagna sheets",
        "bolognese sauce",
        "béchamel sauce",
        "sour cream",
        "grated cheese"
      ],
      "instructions": [
        "Layer bolognese and béchamel sauce alternately with lasagna sheets.",
        "Let it rest in the fridge, ideally overnight.",
        "Bake in a preheated oven at {{160 °C}} fan for about 45 minutes.",
        "Take out, spread with sour cream and distribute cheese on top.",
        "Bake for another 15 minutes."
      ]
    }
  }
}