{
  "language": "de",
  "title": "Rote-Bete-Quiche",
  "default_servings": 2,
  "serving_unit": "Portionen",
  "meal_type": "main",
  "tags": [
    "vegetarian"
  ],
  "related_recipes": [
    "quiche_dough"
  ],
  "version": 1,
  "ingredients": [
    {
      "name": "Quiche-Teig"
    },
    {
      "name": "gekochte, geschälte Rote Bete",
      "amount": 500,
      "unit": "g"
    },
    {
      "name": "Gorgonzola",
      "amount": 150,
      "unit": "g"
    },
    {
      "name": "Walnusskerne",
      "amount": 5,
      "unit": "tbsp"
    },
    {
      "name": "Schmand",
      "amount": 6,
      "unit": "tbsp"
    },
    {
      "name": "Olivenöl",
      "amount": 2,
      "unit": "tbsp"
    }
  ],
  "instructions": [
    "Den Teig ausrollen und in die Form legen (Backpapier verwenden).",
    "Die Rote Bete in schmale Spalten schneiden und in einer Schüssel mit dem Olivenöl und Salz mischen.",
    "Die Walnüsse grob hacken und den Gorgonzola in große Stücke schneiden.",
    "Den Schmand auf den Teig streichen, die Rote Bete darauf geben und Walnüsse und Gorgonzola darüber verteilen.",
    "20-25 Minuten bei {{!180 °C}} backen."
  ],
  "translations": {
    "en": {
      "title": "Beetroot Quiche",
      "serving_unit": "servings",
      "ingredients": [
        "quiche dough",
        "cooked, peeled beetroot",
        "gorgonzola",
        "walnuts",
        "sour cream",
        "olive oil"
      ],
      "instructions": [
        "Roll out the dough and place it in the form (use baking paper).",
        "Cut the beetroot into thin wedges and mix in a bowl with the olive oil and salt.",
        "Roughly chop the walnuts and cut the gorgonzola into large pieces.",
        "Spread the sour cream onto the dough, add the beetroot and distribute walnuts and gorgonzola on top.",
        "Bake for 20-25 minutes at {{!180 °C}}."
      ]
    }
  }
}