{
  "language": "de",
  "title": "Reis kochen",
  "default_servings": 1,
  "serving_unit": "Portionen",
  "meal_type": "basic",
  "tags": [
    "vegetarian",
    "vegan"
  ],
  "version": 1,
  "ingredients": [
    {
      "name": "Naturreis",
      "amount": 1,
      "unit": "cup"
    }
  ],
  "instructions": [
    "Das {{2 cups}}Wasser in einen Topf geben und mit {{0.25 tsp}} Salz zum Kochen bringen.",
    "Den Reis hineingeben.",
    "Die Hitze reduzieren, sodass das Wasser bei geschlossenem Deckel noch leicht kocht.",
    "Den Reis nach Packungsangabe kochen (meist 30-40 Minuten).",
    "Den Reis probieren – das Wasser sollte aufgenommen bzw. verkocht sein.",
    "Eventuell die Kochzeit verlängern und etwas Wasser zugeben oder überschüssiges Wasser abgießen."
  ]
}